<?xml version="1.0" encoding="utf-8"?>
<!DOCTYPE strands SYSTEM "studentresult.dtd">
<strands><strand><title>STEM</title><description/><media>stem.png</media></strand><strand><title>ABM</title><description/><media>seo.png</media></strand><strand><title>GAS</title><description/><media>education.png</media></strand></strands>
